<person xmlns="http://lundogbendsen.dk/schemas/2021/08/03/Person"
        xmlns:xsi="http://www.w3.org/2001/XMLSchema-instance"
        xsi:schemaLocation="http://lundogbendsen.dk/schemas/2021/08/02/Person ./person.xsd">
  <name>ab</name>
  <licensePlate>BB1223</licensePlate>
  <hero>true</hero>
  <netWorth>3</netWorth>
  <birthdate>2007-10-26</birthdate>
  <massOnEarth>1000.00</massOnEarth>
  <favouriteSmallPrime>2</favouriteSmallPrime>
</person>